00:00.0 PCI bridge: Broadcom Inc. and subsidiaries BCM2711 PCIe Bridge (rev 20)
00: e4 14 11 27 06 00 10 00 20 00 04 06 00 00 01 00
10: 00 00 00 00 00 00 00 00 00 01 01 00 00 00 00 00
20: 00 c0 00 c0 f1 ff 01 00 00 00 00 00 00 00 00 00
30: 00 00 00 00 48 00 00 00 00 00 00 00 00 01 02 00
40: 00 00 00 00 00 00 00 00 01 ac 13 48 08 20 00 00
50: 00 00 00 00 00 00 00 00 00 00 00 00 00 00 00 00
60: 00 00 00 00 00 00 00 00 00 00 00 00 00 00 00 00
70: 00 00 00 00 00 00 00 00 00 00 00 00 00 00 00 00
80: 00 00 00 00 00 00 00 00 00 00 00 00 00 00 00 00
90: 00 00 00 00 00 00 00 00 00 00 00 00 00 00 00 00
a0: 00 00 00 00 00 00 00 00 00 00 00 00 10 00 42 00
b0: 02 80 00 00 10 2c 00 00 12 cc 64 00 40 00 12 d0
c0: 00 00 00 00 00 00 40 00 10 00 01 00 00 00 00 00
d0: 1f 08 08 00 00 04 00 00 06 00 00 80 02 00 00 00
e0: 00 00 00 00 00 00 00 00 00 00 00 00 00 00 00 00
f0: 00 00 00 00 00 00 00 00 00 00 00 00 00 00 00 00

01:00.0 USB controller: VIA Technologies, Inc. VL805 USB 3.0 Host Controller (rev 01)
00: 06 11 83 34 46 05 10 00 01 30 03 0c 10 00 00 00
10: 04 00 00 c0 00 00 00 00 00 00 00 00 00 00 00 00
20: 00 00 00 00 00 00 00 00 00 00 00 00 06 11 83 34
30: 00 00 00 00 80 00 00 00 00 00 00 00 3e 01 00 00
40: 00 00 00 00 00 01 00 00 09 80 9e 41 04 00 00 00
50: a1 38 01 00 00 00 00 00 00 00 00 00 06 11 83 34
60: 30 20 00 00 00 00 00 00 00 00 00 00 00 00 00 00
70: 00 00 00 00 00 00 00 00 08 00 03 00 01 00 00 18
80: 01 90 c3 89 00 00 00 00 00 00 00 00 00 00 00 00
90: 05 c4 85 00 fc ff ff ff 00 00 00 00 40 65 00 00
a0: 00 00 00 00 00 00 00 00 00 00 00 00 00 00 00 00
b0: 00 00 00 00 00 00 00 00 00 00 00 00 00 00 00 00
c0: 00 20 00 00 10 00 02 00 01 80 00 00 10 28 19 00
d0: 12 5c 06 00 43 00 12 10 00 00 00 00 00 00 00 00
e0: 00 00 00 00 00 00 00 00 12 00 00 00 00 00 00 00
f0: 00 00 00 00 22 00 01 00 00 00 00 00 00 00 00 00

